{
  "api_version": "kdlc.dev/recorded-release-run/v1alpha1",
  "id": "pre-release-recorded-1",
  "corpus_hash": "sha256:06f863c896eb3760a498d169a65c172a335150c39feb7a9478dd985ba16d8d7c",
  "profile_hash": "sha256:210993836eaeb3221eb3bd4ee818d879b0d1b9f9acaa50d89b97691481065c85",
  "runtime": {"node": "24.5.0", "npm": "11.5.1"},
  "external_network_calls": 0,
  "live_model_calls": 0,
  "results": [
    {"case_id": "recorded-ingest", "case_hash":"sha256:e78974430c6a9f405c3661ee42816f7f1bfc7d40faef8b767ceae6c27f85a87f", "status": "passed", "observations": ["Recorded ingest fixtures validate and replay without a model provider."], "evidence_hash":"sha256:2626a06921e669a2b571bda5a6b3ba71b3c8c9a75a95b8529b7064412c519933"},
    {"case_id": "governed-publication", "case_hash":"sha256:43d88ebd6cb8da7983b8e3711f661ee0649251685b455f5b38dc75eeebd83762", "status": "passed", "observations": ["Approval and publication bind exact persisted review inputs and invalidate on drift."], "evidence_hash":"sha256:2626a06921e669a2b571bda5a6b3ba71b3c8c9a75a95b8529b7064412c519933"},
    {"case_id": "adversarial-governance", "case_hash":"sha256:12179053f70d8f50ec0575cfde4c0324168ba60e564647c71f66ecc08f14945c", "status": "passed", "observations": ["Recorded injection, falsehood, rights, and authority-spoofing cases fail closed."], "evidence_hash":"sha256:6afd8731bb1883573e59ff08d74c2471b2608db687ed0e3a454cc7ea7f0c1f6c"},
    {"case_id": "bounded-normalization", "case_hash":"sha256:50111f300e2d193e938ff29fe6a9e98f979da21358942e1505b925ac3031554a", "status": "passed", "observations": ["Structural profiles remain bounded and unsafe inputs quarantine."], "evidence_hash":"sha256:8c784c4f8d27f447c373af8e17665e7e7d67330203ee56e60f0387d752dc7230"},
    {"case_id": "federated-nondisclosure", "case_hash":"sha256:922f6aa861f32ce4cc7acfb245bb9f949f8c1ff230bc7c0b9e0ffe404ed3853d", "status": "passed", "observations": ["Pre-query authorization, integrity, conflict, and nondisclosure cases pass."], "evidence_hash":"sha256:723b690eced69857745ca2bebe84060a460199cfcce40014bfeae6000d5531e4"},
    {"case_id": "durable-concurrency", "case_hash":"sha256:39a0400d2bfc4b6386e2a2925f7a7c2541a1dcf61bbe1cce6e15dd895e21d3d3", "status": "passed", "observations": ["Cross-instance and crash boundaries preserve durable serialization."], "evidence_hash":"sha256:5581bbafe85cd5edf2ccb4dd7ddc08688c4636e62a95c6f3342109069d40c8eb"},
    {"case_id": "transport-equivalence", "case_hash":"sha256:cbce7f56dc638442eec986817c1d5a5515f3db25cb8d8ab0bd6b08b70461490a", "status": "passed", "observations": ["Recorded governed workflow semantics agree across shipped transports and adapters."], "evidence_hash":"sha256:4e84aefd0804df3da6ee94d93319d9455cba1b429548365c2707b9384bc025a7"},
    {"case_id": "clean-rebuild", "case_hash":"sha256:ffca306ef803003c5e8c30aba9614410ba894ff10de4f37de28ad0374654cc3b", "status": "passed", "observations": ["Clean deterministic index generation reproduces committed bytes and exact retrieval records after cache removal."], "evidence_hash":"sha256:723b690eced69857745ca2bebe84060a460199cfcce40014bfeae6000d5531e4"},
    {"case_id": "governed-revocation-erasure", "case_hash":"sha256:f34a0771e8eb78fcca384434c27d8f6ac12abbdaed2313804e1f9868d3b0846f", "status": "passed", "observations": ["Merged FEAT-009 evidence covers exact impact, authorization, durable erasure, late-copy fencing, legal hold, crash recovery, and retrieval nondisclosure."], "evidence_hash":"sha256:cc3b37fe2511228e6e763d4922f8e9920dd7553a4b1eaa7906d241fae7a635d8"}
  ]
}
